id,publisher,title,link,publish_details,content
1,Hinduatan Times,Indian economy is resilient amid global slowdown: Sitharaman,https://www.hindustantimes.com/india-news/indian-economy-is-resilient-amid-global-slowdown-sitharaman-101700594017690.html,"Nov 22, 2023 08:06 AM IST","Indian economy is resilient amid global slowdown: Sitharaman
ByRajeev Jayaswal, New Delhi
Nov 22, 2023 08:06 AM IST
The Indian economy is “remarkably resilient” amid a global slowdown because of “solid” domestic demand, moderate inflation, sustained capital expenditure and continued buoyancy in revenue collections, the finance ministry said in its monthly review on Tuesday.
The Indian economy is “remarkably resilient” amid a global slowdown because of “solid” domestic demand, moderate inflation, sustained capital expenditure and continued buoyancy in revenue collections, the finance ministry said in its monthly review on Tuesday.
Union finance minister Nirmala Sitharaman. (ANI)
An upbeat farm output has sustained rural demand, which will get a further boost from the winter crop output, said the Monthly Economic Review for October. “Several indicators, such as sales of fast-moving consumer goods and two and three-wheelers, point towards improvement in rural demand,” it said.
We're now on WhatsApp. Click to join.
Rising rural wages, increasing minimum support prices and prospects of healthy sowing for the winter cropping will add further strength to the rural demand, it added. Rapid progress in the procurement of wheat and rice has ensured a continuous increase in food buffers, which will aid in curbing inflationary pressures caused by uneven rainfall distribution in the country, besides strengthening food security, it said.
Industrial activity will expand as the trajectory of manufacturing activity is firm enough to withstand temporary headwinds of rising input costs and realignment of production lines with fast-paced changes in consumer preferences, the ministry said. The fall in the manufacturing Purchasing Managers’ Index (PMI) from 57.5 in September to 55.5 in October is “temporary” due to rising raw material costs. A value greater than 50 signifies expansion.
Although competitive conditions and rising cost pressures led to a moderation in services PMI services to 58.4 in October from 61 in September, it is still in an expansionary zone, it said. “Despite rising input costs, overall sentiment in the services sector remains upbeat, driven, among others, by an upswing in the tourism cum hotel industry induced by leisure travel, business travel, and social events.” The country’s “booming e-commerce industry” is “another strong pillar” of the country’s services sector, the review said.
Notwithstanding geopolitical upheavals and global headwinds due to major central banks keeping interest rates high, India will maintain its growth momentum due to the government’s sustained investment push, healthy corporate profits and a reduction in bad loans, it said. Inflation will ease moderate further as crude oil prices soften, it projected. “Recognising this, RBI (Reserve Bank of India) has also indicated that any further tightening of monetary policy will likely occur when transmission is closer to completion and if the situation warrants,” the review said.
The report, however, cautioned about inflationary pressures, particularly due to external factors. “With more than half of the current financial year witnessing positive developments in the economy, the full financial year should conclude as projected with a strong growth performance and macroeconomic stability,” it said. “Yet, risks on the downside persist. Inflation is one of them that has kept both the government and the RBI on high alert.”
Financial flows in the external sector also need monitoring as they impact the value of the rupee and the balance of payments, it said. “A fuller transmission of the monetary policy may also temper domestic demand,” it added.
India’s growth in the year to March should continue to be a “positive outlier” compared with other major economies, the review said. In the medium-term, a sustained focus on public investment in infrastructure and advances in digital public infrastructure would enable India to look forward to a longer economic and financial cycle than in the past, it said.
“A normalising base and an erratic monsoon are expected to result in a sequential moderation in the GDP [gross domestic product] growth to 7.0% in Q2 FY2024 from 7.8% in Q1 FY2024. Regardless, we anticipate that the GDP expansion in this quarter will exceed the Monetary Policy Committee’s (MPC’s) October 2023 projection of 6.5%,” Aditi Nayar, Chief Economist, Head-Research & Outreach, ICRA Ltd, said.
“Looking ahead, uneven rainfall, narrowing differentials with year-ago commodity prices, the possible slowdown in momentum of Government capex as we approach the Parliamentary Elections, weak external demand and the cumulative impact of monetary tightening are likely to translate into lower GDP growth in H2 FY2024. As a result, we maintain our FY2024 GDP growth estimate at 6.0%, lower than the MPC’s projection of 6.5% for the fiscal,” she added.
Get Latest India News along with Latest News and Top Headlines from India and around the world
Indian Economy
Capital Expenditure"
2,Hinduatan Times,India to become third largest economy by 2027: FM Sitharaman,https://www.hindustantimes.com/business/india-to-become-third-largest-economy-by-2027-fm-sitharaman-101700040285170.html,"Nov 15, 2023 03:07 PM IST","India to become third largest economy by 2027: FM Sitharaman
PTI | | Posted by Singh Rahul Sunilkumar
Nov 15, 2023 03:07 PM IST
India's economic growth is projected to be just under 7% this year, the highest among major economies, despite global headwinds, said Nirmala Sitharaman.
Finance Minister Nirmala Sitharaman on Wednesday said India is expected to overtake Japan and Germany to emerge as the third largest economy in the world by 2027.
Finance minister Nirmala Sitharaman.(HT)
Addressing the Indo-Pacific Regional Dialogue here, Sitharaman said India's economic growth is estimated to be just under 7 per cent during the year, the highest among major economies, despite global headwinds.
We're now on WhatsApp. Click to join.
The Indian economy is therefore on the right track and is heading towards a bright future, she said.
Amidst supply-chain disruptions and economic turbulence due to contemporary conflicts that impact the Indo-Pacific, irrespective of whether they are occurring in relatively distant Ukraine or in relatively-proximate Israel or Yemen, and despite the palpable tensions prevalent in the South- and East China Sea, the Indian economy stands out as a bright spot, she said.
""Even according to the usually conservative estimates of the IMF, the Indian economy is set to emerge as the world's third largest economy by 2027, hopping over Japan and Germany, as its GDP crosses the USD 5 trillion level. By 2047, India aspires to be a developed economy,"" she said.
Talking about India's 'Blue economy', she said, it accounts for roughly 4 per cent of the GDP and represents a sea of opportunities.
India has 9 states and 4 Union Territories situated on the coast, 12 major and 200 non-major ports situated along its coastline, and a vast network of navigable waterways for international and domestic trade, she said.
According to the UNCTAD, India was the 2nd largest exporter of ocean-based goods and services among developing countries in 2020.
Observing that Indo-Pacific is undoubtedly the world's most economically dynamic region, Sitharaman said it encompasses 60 per cent of global GDP, and almost 50 per cent of global merchandise trade.
On the other hand, the Indo-Pacific is also a geopolitically contested space that is being roiled by great power competition, she said.
""One draws its legitimacy from an internationally accepted and consensually derived rules-based order. India stands firmly and proudly in the vanguard of this system,"" she said.
While the other seeks to discredit and disrupt this consensually derived rules-based order and supplant it with an international order whose rules are generated in an exclusive State, she said.
As India accelerates its economic growth and uplifts its teeming masses, moving them from poverty to prosperity, she said it is registering impressive gains in its comprehensive national power as well as in terms of its international stature.
""Today, Indians 'whether at home or abroad' stand, walk, talk, and act with their heads held high... even as the world appreciates India's achievements and successes and lauds it for its demonstrated resilience amidst multiple crises, we are very clear that we cannot afford to be an inward-leaning power,"" she said.
""Our focus on transitioning from a 'brown' economic model to a 'blue' one and thereafter extrapolating this blue transition across the length and breadth of the Indo-Pacific demands that we shoulder greater and heavier regional responsibilities, and this is precisely what we are doing,"" she said.
India has significantly improved its position as a well-governed and innovative country with a conducive environment for business, as reflected in several global indices.
Noting that the country's comprehensive national power is going to remain inextricably linked to the ocean, she said India is seized of the pressing need to grow the maritime sector as a whole and the government is determined to provide the requisite support by way of fiscal policy and financial outlay.
""We seek to position India as a hub in new and diversified supply chains and value chains across the Indo-Pacific and, indeed, across the world.
""Towards this end, I am happy to inform you that all sectors of the government are responding exceedingly positively to our new financial policies,"" she said.
In terms of international shipments, she said India's global ranking has risen from 44th place in 2014, to the 22nd rank in 2023.
Similarly, as per the World Bank's Logistics Performance Index report 2023, she said, the 'turn-around time' of Indian ports is now just 0.9 days, which is lower than ports in established maritime centres such Singapore, the UAE, Germany, the USA, Australia, Russia, and South Africa.
""Our experience of the maritime manifestations of the Covid-19 pandemic has led to shipping insurance, too, becoming a particular area of policy focus,"" she said.
On the one hand, a 'Marine Cargo Pool' has now been created with the full support of the Insurance Regulatory and Development Authority of India and domestic insurance companies, to support maritime trade on the other hand the country is improving its strength in shipping arbitration, and in order to reduce India's vulnerability to international sanctions.
To provide greater strategic flexibility in shipping operations, she said ""we are setting up a full-fledged Indian-owned and India-based Protection and Indemnity (P&I) entity that will additionally provide protection to coastal and inland shipping.""
On the capacity building front, she said, as many as 31 projects have been identified in 9 major ports for monetisation under the National Monetisation Pipeline (NMP) launched in 2022, with a total estimated CAPEX of 14,483 crore rupees (1.74 billion US dollars) for FY 2022-25.
Terming India-Middle East-Europe Connectivity Corridor (IMEC) as one of the most promising connectivity projects, Sitharaman said it will be a win-win situation for all states involved, as it enhances transportation efficiency, reduces logistic costs, increases economic unity, generates employment, and lowers Greenhouse Gas emissions, contributing to a cleaner, safer, better world.
""However, it is not without its geopolitical challenges and the ongoing conflict in Israel and Gaza is a worrying manifestation of these,"" she said.
The IMEC was signed at the 18th G-20 Summit held in New Delhi in September.
It is a multimodal economic corridor that incorporates multiple networks of shipping, railways, and roadways and will also include electricity cables, high-speed data cables, and a hydrogen pipeline.
The corridor is expected to create a reliable and cost-effective cross-border, ship-to-rail transit network to supplement existing maritime and road transport, and facilitate trade and connectivity, leading to the economic integration of South Asia, West Asia, Europe, and the Middle East.
Indian Economy
Gdp
Imf
Nirmala Sitharaman"
3,Hinduatan Times,India’s K-shaped recovery crisis,https://www.hindustantimes.com/editorials/indias-k-shaped-recovery-crisis-101699714673694.html,"Nov 13, 2023 09:14 AM IST","India’s K-shaped recovery crisis
ByHT Editorial
Nov 13, 2023 09:14 AM IST
IIP numbers reveal consumption demand at the bottom of the pyramid needs to pick up for economic growth to regain momentum
The Index of Industrial Production (IIP) grew at 5.8% in September, a sharp fall from the 10.3% print in August. The latest IIP numbers are in keeping with the trend in the Purchasing Managers Index (PMI) for manufacturing, which continues to be in an expansion zone, but has been losing momentum. What is the larger message behind these numbers? Should the loss of economic momentum be a cause for concern? Three points need to be made here.
PREMIUM
The Index of Industrial Production (IIP) grew at 5.8% in September(Bloomberg File Photo)
One of the factors driving relatively muted growth in the past few months is the waning of a favourable base effect. This may hold not just for high-frequency numbers such as IIP and PMI but also GDP figures. To be sure, the RBI governor has gone on record to say that the September quarter GDP numbers could end up higher than the 6.5% projection by the Monetary Policy Committee of RBI. This is in line with analysts saying the Indian economy continues to be resilient despite some loss in momentum.
The second factor is the question of what is driving growth. A use-based classification of the IIP numbers shows that capital goods and infrastructure are leading a growth charge while consumer goods are yet to gain momentum. This, once again, is not a new phenomenon and has been a hallmark of the Indian economy in the post-pandemic phase, which has also seen a sharp increase in central government capital spending. Apart from being a short-term growth driver, government capex is also creating valuable infrastructure for future growth.
Without any prejudice to these first two factors, there is a third point that merits flagging. As long as consumption demand does not gather a sustained momentum, private investment will continue to remain weak. It is the virtuous cycle of precisely these two variables that can put the Indian economy on a sustained growth path that is more than the current 6%-6.5%.
Given that a lot of anecdotal evidence and sales numbers point towards strong demand by the rich, the problem and its solution have to be located at the bottom of the pyramid. The world’s fastest-growing economy must not lose sight of its K-shaped recovery problem.
Continue reading with HT Premium Subscription
Daily E Paper I Premium Articles I Brunch E Magazine I Daily Infographics
Subscribe Now @1199/year
Already Subscribed? Sign In
Infrastructure
Growth
Indian Economy
September
Rbi Governor
Pmi
Capital Goods
Consumer Goods
Index Of Industrial Production
Iip"
6,Hinduatan Times,Reliable data key for India to achieve high-income status: World Bank,https://www.hindustantimes.com/business/reliable-data-key-for-india-to-achieve-high-income-status-world-bank-101697732849191.html,"Oct 19, 2023 10:17 PM IST","Reliable data key for India to achieve high-income status: World Bank
PTI | | Posted by Singh Rahul Sunilkumar
Oct 19, 2023 10:17 PM IST
Countries like India need policies based on reliable data for sustainable growth: World Bank chief economist Indermit Gilll
Middle-income countries like India need to make policies based on reliable data to get into the league of high-income nations in next 3-4 decades as achieving sustainable growth will become harder, World Bank chief economist Indermit Gill said on Thursday.
Chief Economist of the World Bank Group Indermit Gill (C)(AFP)
Addressing an event here, Gill said, to grow into higher-income countries, MCIs (Middle Income Countries) will have to reduce deficits in their mid-sized firms.
We're now on WhatsApp. Click to join.
""(Going forward) economic growth will get harder for middle-income countries like India, not easier... If you (middle-income countries like India) want to get into high-income country in the next 3-4 decades then you will have to make policies based on reliable information,"" he said.
Gill pointed out that relatively few countries (31) have grown into high-income countries between 1990 and 2021.
Prime Minister Narendra Modi has set an ambitious target of making India a developed nation by 2047.
According to the World Bank, the world's middle-income countries (MICs) are a diverse group by size, population, and income level.
They are defined as lower middle-income economies -- those with a GNI (Gross National Income) per capita between USD 1,036 and USD 4,045; and upper middle-income economies -- those with a GNI per capita between USD 4,046 and USD 12,535.
Middle-income countries are home to 75 per cent of the world's population and 62 per cent of the world's poor.
At the same time, MICs represent about one-third of global GDP and are major engines of global growth.
Countries with annual per capita income of over USD 12,000 are defined as high-income economies.
World Bank
Indian Economy"
7,Hinduatan Times,Why we must cheer the Nobel for Goldin,https://www.hindustantimes.com/opinion/why-we-must-cheer-the-nobel-for-goldin-101697205775646.html,"Oct 13, 2023 10:27 PM IST","Why we must cheer the Nobel for Goldin
By
Namita Bhandare
Oct 13, 2023 10:27 PM IST
Claudia Goldin's research on women's labor force participation challenges traditional economic assumptions
I can think of three reasons to celebrate Claudia Goldin’s win of the Economics Nobel Prize—or the Sveriges Riksbank Prize in Economic Sciences in Memory of Alfred Nobel to use its proper name. She’s only the third woman to be awarded an economics Nobel and, unlike Esther Duflo and Elinor Ostrom, the first to get it on her own without a male colleague.
Economic historian Claudia Goldin, a Harvard professor who won the 2023 Nobel economics prize for her work examining wage inequality between men and women, speaks at a news conference at Harvard University in Cambridge, Massachusetts, U.S., October 9, 2023. REUTERS/Reba Saldanha (REUTERS)
Moreover, Nobel 2023 has seen four women honoured this year; for peace (Narges Mohammadi), medicine (Katalin Kariko jointly with Drew Weissman), physics (Anne L’Huillier with Pierre Agostini and Ferenc Krausz) and economics. Given that in 121 years, from 1901 to 2022, only 60 women had won the prize, this is quite a haul.
We're now on WhatsApp. Click to join.
It’s the third reason that I’m cheering the loudest. An economic historian at Harvard University, Goldin, now 77, has since the 1970s been looking at a topic that has gained currency in recent times: Women’s labour force participation. Until the Second Wave Feminism’s raised consciousness of the 1970s, the history of economics had been written by men. The assumption, notes the Economist, was that economic growth led to a more level playing field.
Goldin’s work put that assumption on its head. “She had to be a detective,” Randi Hjalmarsson, a member of the prize committee said. What she unearthed was a narrative arc of women’s lives and employment that was quite different from that of men’s. The shift from agrarian to factory economics, she found, resulted in women dropping off paid employment as they found it difficult to balance home responsibilities with long factory shifts. It was only with the rise of the services sector in the 20th century that women bounced back to paid work, in what Goldin and other economists call the U-curve.
As a woman, Goldin asked questions rarely, if ever, asked before. Did the contraceptive pill impact labour force participation? Yes, obviously.
When it came to the gender wage gap that persists well into the 21st century, she looked at the possible reasons. Perhaps the fault lay with ‘greedy’ professions like law and consulting that demand long hours. When women become mothers, they either drop out of work, or take a salary hit because they simply don’t have enough hours to put in the time.
Her findings told the world the story of the other half. It’s a story that needs to be told; a story that visibilises the invisible and valuable work of women.
“Feminist economists have long argued for the need to recognize the paramount value of ‘reproductive labour’ that most often is performed by women, that allows the ‘productive economy’ to function smoothly,” said Prof Ashwini Deshpande, head of the economics department at Ashoka University.
All women work, but not all women are paid for their work. And yet it is women’s unpaid work in cooking, cleaning and taking care of the kids, elderly and sick that enable men to pursue paid work. Or, to put it another way, the more time women spend on unpaid care work, the less time they have for paid work.
Goldin’s research is limited to the US market. There are differences with India where women bear one of the world’s largest burdens of unpaid care work. This explains to a certain degree the mystery of the missing women from our workforce. In the post-liberalisation years when the economy was opening up and new opportunities were presenting themselves, at a time when 24.3 million men went to work, women were quitting paid work in droves. A 2017 World Bank report noted that partly this was due to the fact that girls were opting to stay on in school. But partly it had to do with how we saw women’s place in society.
Over a year in 2017, I wrote a series of articles trying to understand the roadblocks to women’s employment. The first dip came not from motherhood but from marriage. There were other issues, the lack of safe and affordable public transport, a not-unjustified perception of public safety, and the distrust of women’s agency.
These were stories that could never be understood or told, unless you were actively looking at gender implications. Alongside there was a growing body of work that studied the likely impact on economies and GDP if women worked at par with men. All of this led to a new and growing conversation on the need to look at policy changes that would enable women to stay the course.
For far too long we had viewed economics as if gender didn’t matter. Now, we know and acknowledge that it does. Goldin’s work has not just shown the need for this conversation but opened the path for scores of younger feminist economists to examine, question and rewrite received wisdom about women and work.
Namita Bhandare writes on gender. The views expressed are personal
ABOUT THE AUTHOR
Namita Bhandare
Namita Bhandare writes on gender and other social issues and has 25 years of experience in journalism. She has edited books and features in a documentary on sexual violence. She tweets as @namitabhandare
Indian Economy"
