id,publisher,title,link,publish_details,content
28,Hinduatan Times,Time to breathe life into the India story,https://www.hindustantimes.com/opinion/time-to-breathe-life-into-the-india-story-101687753460686.html,"Jun 26, 2023 10:14 AM IST","Time to breathe life into the India story
By
Shashi Shekhar
Jun 26, 2023 10:14 AM IST
Through Indian immigrants and Indian traditions, Modi has now begun to influence the internal politics of other democracies throughout the world.
What makes June 21, 2015, different from June 21, 2023? When Prime Minister (PM) Narendra Modi performed yoga with thousands as part of Yoga Day eight years ago, others dismissed it as a “show” by a political “showman”. The significance of such showmanship in politics, diplomacy, and public life was evident in New York this time around.
PREMIUM
When Prime Minister (PM) Narendra Modi performed yoga with thousands as part of Yoga Day eight years ago, others dismissed it as a “show” by a political “showman”.
Modi practised yoga with delegates from 183 countries on the North Lawn of the United Nations (UN) Headquarters on that day. Until recently, his predecessors used to utilise their overseas trips to promote domestic politics. Through Indian immigrants and Indian traditions, Modi has now begun to influence the internal politics of other democracies throughout the world. As yet, prior to him, no Indian PM has recognised this power.
Its first impressions began to emerge shortly after ‘Howdy Modi’ was held on September 22, 2019, in Texas. Addressing an Indian crowd in the presence of then United States (US) President Donald Trump, the PM demonstrated to the entire world for the first time that these are the days of Indian pride. Modi was aware that the number of non-resident Indians in the US is close to 4.5 million. They play a vital role in the local political, social, and economic landscape. This is why, like Trump, president Joe Biden has indicated his resolve to deepen ties with these voters via Modi. In a democracy, nothing is more vital than the voter and his/her vote.
Consequently, India and the Indian diaspora are becoming increasingly significant to western countries, including the US. Indian immigrants in Africa were already powerful enough.
The US is the most powerful country in the world, and we are the largest democracy. It is easy to argue that, in the shifting global geopolitical landscape, the US needs India and India needs the US. Can you envisage such relations between the US and Afghanistan, or between the US and Russia? Successful partnerships cannot be formed solely based on necessities.
Take Pakistan for example. We fought four wars against that country. It continues to wage a shadow war against us, costing billions of dollars and human lives each year. Despite this, why have our social ties with Pakistan remained? Language, culture, cuisine, and people-to-people relationships never change.
Similarly, the way the Indian diaspora has reinforced its standing in nations such as the US, Australia, and the United Kingdom has made dialogue between the government in New Delhi and their leaders easier.
I was in Singapore and Malaysia last week. On this five-day trip, I had to deal with four interpreters. Those with me in Singapore were of Chinese ancestry. They kept emphasising that we have more than 9% Tamils here, who make significant contributions to the country. They brought up PM Modi’s name often during the conversations. This has never happened before. The same was true about Malaysia. In reality, the Indian diaspora has a strong sense of optimism about India today. If you don’t believe me, look at the news from last Thursday. There were two more news pieces, both of which were prominently published along with Modi’s yoga event. The Indian stock market had reached a new high, and gold prices had dropped by ₹360. The data from the last three years show that, despite Covid and the Russia-Ukraine war, the Indian economy outperformed expectations. Despite rising prices and unemployment, the Indian market and buyers remain optimistic. Covid-19 and the Russia-Ukraine war have pushed Europe into a recession, but the Indian markets have returned to glory.
It’s no surprise that many economists believe India will dominate for the next 15 years.
Indeed, India and people of Indian origin have come a long way. I recall the time when Mahendra Pal Chaudhary, a person of Indian origin, was elected PM of Fiji in 1999. His government survived just a year in power with great difficulty. On May 27, 2000, the majority of his cabinet and he himself were captured by Opposition leader George Speight and rebel forces.
At present, Rishi Sunak is the PM of Britain, making Indians all around the world feel proud. The country that left us poor 75 years ago is now in the hands of an Indian. Today, CEOs of Indian origin lead 25 of the world’s top 500 corporations. People of Indian origin have a voice in parliaments, ministries, and in big institutions on every continent. There is no better time than now to breathe new life into the “India story” that former PM Manmohan Singh once crafted.
PM Narendra Modi is doing an exemplary job in this regard.
Shashi Shekhar is editor-in-chief, Hindustan. The views expressed are personal
Continue reading with HT Premium Subscription
Daily E Paper I Premium Articles I Brunch E Magazine I Daily Infographics
Subscribe Now @1199/year
Already Subscribed? Sign In
Indian Economy"
30,Hinduatan Times,"With Covid-19 abated, time to roll back Press Note 3, 2020 restrictions",https://www.hindustantimes.com/ht-insight/economy/with-covid-19-abated-time-to-roll-back-press-note-3-2020-restrictions-101686477377673.html,"Jun 11, 2023 03:55 PM IST","With Covid-19 abated, time to roll back Press Note 3, 2020 restrictions
ByHindustan Times
Jun 11, 2023 03:55 PM IST
This article is authored by Bikash Narayan Mishra, former banker and senior advisor, IBA.
It can sometimes be useful to carve out a “then and now” scenario mapping to gauge changes on how the needle has moved on the scale of time. Some markers are more visible and pronounced than others.
Startup ecosystem(HT File)
There are striking dissimilarities between May 2020 and May 2023. Three years ago, the world was staring at an uncertain path as the Covid-19 pandemic swept through the world.
We're now on WhatsApp. Click to join.
Last three years the pandemic devastated economies. Across the world, policy makers rummaged through options to save their economies and limit the debilitating consequences on lives and livelihoods.
India also came out with Press Note 3, aimed at curbing predatory takeovers by foreign entities, needs to be reviewed in the current economic situation.
As companies across the globe battled the uncertainty that the pandemic brought on in 2020, several economies began to raise concerns about opportunistic takeovers of entities stressed by pandemic in their country.
India introduced Press Note 3 (PN3) in 2020, which required all foreign direct investment (FDI) proposals from an entity based in a country that shares a land border with India, or where the beneficial owner of such FDI is situated in a country which shares a land border with India — both referred to as “restricted entities” — were brought under the government approval route.
The Press Note expanded the list of countries whose investors are no longer eligible to invest in India under the automatic route. Importantly, for start-ups, an investment in India now falls under the government route if it is from an entity whose ""beneficial owner"" is from such a bordering country.
The term beneficial owner has different meanings under different laws in India. Depending on how it is defined it could mean (i) an entity with a prescribed shareholding level in the investing entity (as is the case under the Companies Act of 2013) or (ii) the owner or holder of ultimate control over the investing entity (as defined under the Prevention of Money-laundering Act, 2002). A somewhat similar concept is also used by the Securities and Exchange Board of India to identify the ultimate beneficial owner for the purposes of certain securities laws.
It is a very different world now in May 2023. The pandemic’s in retreat. There’s now an unmistakable excitement and optimism about India, even at a time when large parts of the developed world stare at an imminent recession.
The Economic Survey 2022-2023 has put India’s medium-term Gross Domestic Product growth potential between 7-8%. The International Monetary Fund (IMF) says India will grow 6.1% in 2023-24 and accelerate further to 6.8% in 2024-25, firmly cementing India as a powerful growth engine. Economists agree that India is on track to be the third largest within five years.
More importantly, the World Health Organization (WHO) has declared that Covid-19 no longer represents a ""global health emergency"".
The statement marks an end to the pandemic and comes three years after it first declared its highest level of alert over the virus.
Reports suggested that virus' death rate had dropped from a peak of more than 100,000 people per week in January 2021 to just over 3,500 on 24 April.
The government has approved 98 foreign direct investment (FDI) proposals from countries sharing land border with India since April 2020 out of 423 received from sectors including trading and electronics.
On a net basis, FDI inflows into India fell 27% to $28.014 billion in FY23 from $38.59 billion in FY22. In the last 10 years, this is the first fall in FDI in the country.
This may be the right time to roll back some policies such as Press Note 3 2020 that were introduced as a precaution to shield the pandemic’s effect on the Indian economy.
The funding winter for Indian start-ups has lasted well into the sweltering summers. These enterprises are innovators and job generators. Adequate capitalisation of start-ups by removing policy barriers is necessary for the Indian economy to canter to its full potential.
This article is authored by Bikash Narayan Mishra, former banker and senior advisor, IBA.
Fdi
Indian Economy"
31,Hinduatan Times,Chief economic advisor against Universal Social Security for India. Why? He says,https://www.hindustantimes.com/business/chief-economic-advisor-v-anantha-nageswaran-against-universal-social-security-for-india-101686319427067.html,"Jun 09, 2023 07:55 PM IST","Chief Economic Advisor against Universal Social Security for India. Why? He says…
PTI | | Posted by Singh Rahul Sunilkumar
Jun 09, 2023 07:55 PM IST
Notably, former CEA Arvind Subramanian during the first term of the Narendra Modi government had mooted the idea of a uniform stipend to citizens.
Chief Economic Advisor (CEA) V Anantha Nageswaran on Friday dismissed the idea of Universal Social Security, saying it will create a ground for ""perverse incentives"" for people and dissuade them from seeking income-generating opportunities. (ALSO READ: RBI forecasts GDP growth at 6.5%, retains April projection)
Chief economic advisor V Anantha Nageswaran (PTI)(MINT_PRINT)
‘We may be creating the ground for perverse incentives’
He said the concept of Universal Social Security is not favourable for developing countries like India which need to focus on economic growth to take care of the aspirations of its people.
We're now on WhatsApp. Click to join.
""For our country, when natural economic growth should take care of many of the aspirations, it (Universal Social Security) may not be necessary. We may be creating the ground for perverse incentives for people to not make their own effort in seeking such opportunities. So therefore, Universal Social Security for India is not something that should be on the agenda in the near term,"" he said at an event here.
However, he said, support should be confined to those who may not be able to participate in economic activities and bring them up to a point where they can meaningfully engage in the economy.
India has not reached the stage where it is a moral or economic necessity to have Universal Social Security, he added.
ALSO READ | Towards universal social security: Priorities for G20
Former CEA mooted the idea of a uniform stipend
It is to be noted that former Chief Economic Advisor Arvind Subramanian during the first term of the Narendra Modi government had mooted the idea of a uniform stipend to citizens.
Subramanian in the Economic Survey 2016-17 had proposed the idea of universal basic income (UBI) or a uniform stipend to every adult and child, poor or rich.
The survey said UBI would guarantee all citizens enough income to cover their basic needs and would be easier to administer than the current anti-poverty schemes, which are plagued by waste, corruption and abuse.
'We need 3-5 years of 10 per cent steady nominal GDP growth'
With regard to Fiscal Responsibility and Budget Management (FRBM), Nageswaran said, the overall goal of ensuring fiscal stainability has not gone away at all even though the mechanism for doing so might vary depending on the compulsions of the time.
So, he said, a 4.5 per cent gross fiscal deficit ratio is in place.
In the Budget speech, Finance Minister Niramala Sitharaman said the fiscal deficit in 2022-23 was estimated at 6.4 per cent of GDP, which was consistent with the broad path of fiscal consolidation announced by her to reach a fiscal deficit level below 4.5 per cent by 2025-26.
To achieve the target, Nageswaran said, ""All we need to achieve is 3-5 years of 10 per cent steady nominal GDP growth and all these fiscal parameters will automatically improve because our growth rate is higher than the cost of borrowing.""
Nageswaran on public debt
India's gross debt was at 81 per cent of GDP in 2005 which increased to 84 per cent now, he said, adding, only two other countries have done better than India -- Indonesia and Germany with a 2 per cent slippage in the overall debt to GDP ratio.
""Many other countries in the G20 and beyond have seen a slippage in their debt ratio by an order of magnitude of 40 to 80 percentage points...we are at least held steady and we are a country which has a potential to grow in nominal terms between 10 and 11 per cent
""All that being said, I will also concede that we are at BBB minus. Even a country like the Philippines, which is much smaller than us has a BBB plus credit rating. And that means if you go from BBB minus to BBB plus your government's cost of borrowing will come down by 100 basis points and that is a fiscal stimulus,"" he said.
So, good fiscal health would translate into a good fiscal stimulus for citizens because interest rates will come down, he said.
""So we are aware of that and we are working towards it. Asset monetization and natural economic growth should help.
""There is no second opinion on the importance of keeping at it and achieving these numbers and getting to a better credit rating because it's not just a question of prestige, it's a question of actually putting more money in the hands of people through lower interest rates,"" he said.
He also said improving macroeconomic parameters have raised the prestige of India at the global forum.
Sharing a personal experience, he said, his son, who was born in Singapore and currently studies in America made a statement that ""nowadays even in the US, it is very cool to be an Indian. Modiji has made it very cool to be an Indian.""
CEA on artificial intelligence
Nageswaran also cautioned the IT industry to be prepared for the onslaught of Artificial Intelligence (AI) impacting their growth.
""Artificial Intelligence can take away the need for a lot of people. Indian software exporters. Therefore, we need to be cautious about whether AI will make a competitive threat to India's IT-enabled services growth. So, we need to think ahead and plan ahead. AI make a competitive threat to India's IT sector growth,"" he said.
Talking about the resilient Indian economy, he said it is in a state of autopilot, bouncing back impressively after the pandemic and expected to grow in a range of 6.5-7 per cent in the current fiscal.
Sharing his optimism on the medium-term growth prospects of the Indian economy, he said that the sound macroeconomic policies of the government, structural reforms, such as GST, IBC etc, thrust on infrastructure and digitalisation, have ensured that the Indian economy can grow for a longer period without running into overheating problems.
CEA on investments, private consumption and inflation
On capex, he said that the private sector is poised to attain stronger investment growth following the strengthening of corporate balance sheets, and stronger bank balance sheets, which has improved their ability to lend and support from the government's capex push.
Over the medium term, investments will remain a key driver of growth. The uptick in investments will drive the manufacturing output too, he said at the CII event here.
Private consumption, which contributes close to 60 per cent to GDP, has surpassed the pre-pandemic trend in the third quarter of last fiscal contributed by the release of pent-up demand and recovery in rural demand, he said.
Going ahead, he said, a lower inflation outlook due to easing commodity prices, good harvest and pass-through of lower input costs, will have a salutary impact on boosting the consumption spending further this fiscal.
Economic Growth
Indian Economy"
32,Hinduatan Times,FY23 GDP growth hits 7.2% after a strong Q4,https://www.hindustantimes.com/india-news/indian-economy-surges-with-7-2-gdp-growth-in-2022-23-boosted-by-services-exports-and-agriculture-101685557699062.html,"May 31, 2023 11:58 PM IST","FY23 GDP growth hits 7.2% after a strong Q4
By
Roshan Kishore
, New Delhi
May 31, 2023 11:58 PM IST
GDP numbers exceeded the government’s own projections and was the result of a better-than-expected performance in the last quarter of the fiscal
The Indian economy grew at 7.2% in the fiscal year 2022-23, positively surprising most analysts and exceeding the government’s own projection of 7% GDP growth. The unexpected upside in the GDP numbers is a result of a better-than-expected performance in the last quarter of the fiscal, and powered by services, exports, and agriculture. GDP growth in the quarter ending March 2023 was 6.1%, which is a full percentage point higher than the median forecast of 5.1% by a Bloomberg poll of economists. Second advance estimates for 2022-23 GDP – they were released on February 28, 2023 – had also assumed a 5.1% growth in the March quarter. The latest numbers vindicate RBI governor Shaktikanta Das who, on May 24, said that the 2022-23 GDP numbers could end up being higher than the projected 7% figure.
Labourers at a construction site in Mumbai. (AFP)
While the 2022-23 annual GDP growth number is lower than the 9.1% print for 2021-22, it needs to be remembered that the 2021-22 growth was on the back of a 5.8% contraction in 2020-21. RBI’s Monetary Policy Committee (MPC) expects the economy to grow at 6.5% in 2023-24.
We're now on WhatsApp. Click to join.
“The 2022-23 GDP growth figures underscore the resilience of the Indian economy amidst global challenges. This robust performance along with overall optimism and compelling macro-economic indicators, exemplify the promising trajectory of our economy and the tenacity of our people,” Prime Minister Narendra Modi said in a tweet.
A disaggregated analysis of the latest GDP numbers shows that consumption and investment have emerged as key drivers of growth. At 34%, the share of Gross Fixed Capital Formation (GFCF) – it measures investment spending – in overall GDP is the highest since 2012-13. However, a lack of momentum in manufacturing – it shows an annual growth of just 1.3% – continues to be a cause of concern. Services, on the other hand, have grown at 9.5%. Trade, hotels, transport, communication and broadcasting services, which has the largest employment share within services has shown an annual growth of 14% in 2022-23.
To be sure, the headline annual and quarterly GDP numbers hide a variation in key drivers of growth in the first and second half of the fiscal. For example, private final consumption expenditure (PFCE) grew at just 2.2% and 2.8% in the quarters ending December 2022 and March 2023 compared to the 19.8% and 8.3% values in the quarters ending June 2022 and September 2022. This suggests that some of the consumption boost in 2022-23 could have been pent-up demand that has since ebbed.
GFCF growth was an impressive 8% and 9% in the quarters ending December 2022 and March 2023. Reading the GFCF numbers with government final consumption expenditure (GFCE) clearly shows that the government has shifted the fiscal ballast from revenue spending to capital spending. Annual GFCE growth in 2022-23 is just 0.1%, and it actually saw a contraction in the September and December quarters.
A sustained revival in the investment cycle, however, will require a healthy growth in private consumption growth, which as per the latest quarterly numbers, seems to be losing momentum.
Export and import numbers suggest that the economy has gained significantly due to imports slowing down much more than exports. While goods and services exports grew at 11.1% and 11.9% in the quarters ending December 2022 and March 2023, import growth was 10.7% and 4.9% in these periods.
“March quarter GDP growth came in much higher than expected, led by stronger agriculture, manufacturing, investment and exports. Some of the strength may have been led by statistical factors, i.e. the practice of single deflation in calculating GDP growth. The informal sector has rebounded recently, but with global growth slowing, softer domestic growth prints could follow,” said Pranjul Bhandari, chief India and Indonesia economist at HSBC research, in a note.
“We expect GDP to grow 5.5% in FY24. We expect the RBI to be on hold for the rest of the year, and cut the repo rate by 25bps in 1Q2024,” Bhandari added.
“For FY 23-24, despite today’s upside surprise, we maintain our forecast of 6.3%, with domestic demand driving the rise and the moderation coming largely from weaker manufacturing and exports in a global slowdown. We forecast continued steady GDP growth of 6.5% in FY 24-25. With inflation moderating and expected to stay close to the target, we think the window for rate hikes has closed. We expect RBI to remain on hold at its MPC meeting next week,” Rahul Bajoria, MD and head of EM Asia (ex-China) Economics, Barclays, said in a note.
Get Latest India News and Uttarakhand Tunnel Collapse Live Updates along with Latest News and Top Headlines from India and around the world
ABOUT THE AUTHOR
Roshan Kishore
Roshan Kishore is the Data and Political Economy Editor at Hindustan Times. His weekly column for HT Premium Terms of Trade appears every Friday.
Agriculture
Gdp Growth
Services
Indian Economy"
