id,publisher,title,link,publish_details,content
14,Hinduatan Times,"Decisiveness needed for India to be third largest, says finance minister",https://www.hindustantimes.com/india-news/decisiveness-needed-for-india-to-be-third-largest-says-finance-minister-101696532186288.html,"Oct 06, 2023 07:00 AM IST","Decisiveness needed for India to be third largest, says finance minister
ByRajeev Jayaswal
Oct 06, 2023 07:00 AM IST
India's Finance Minister Nirmala Sitharaman said that the country's rise to the fifth-largest economy in the world was due to a conscious strategy and political will. She emphasized that achieving the goal of becoming the third-largest economy would depend on political stability, policy consistency, and decisiveness. The Congress party criticized Prime Minister Narendra Modi's guarantee of India's emergence as the third-largest economy, stating that it was an arithmetical inevitability. Sitharaman highlighted the efforts of the Indian people in driving the economy's growth and warned that any instability in political will would hinder economic performance.
New Delhi:The transformation of Indian economy from the world’s tenth largest to the fifth position in nine years is a result of conscious strategy and strong political will, according to Union finance minister Nirmala Sitharaman, who on Thursday said that next journey to the third rank would not be a “fait accompli” as it would depend on “political stability”, “policy consistency” and “decisiveness” of the government.
Union Finance Minister Nirmala Sitharaman (PTI)
Speaking at the annual day celebration of Sri Ram College of Commerce (SRCC), Sitharaman said that steps taken under the guidance of Prime Minister Narendra Modi made India the fifth largest economy of the world.
We're now on WhatsApp. Click to join.
While inaugurating the Bharat Mandapam on July 26, the Prime Minister assured the nation that in the third term of the BJP government, India will be among the top three economies in the world. “Yes, my friends, in the third term, India will be there with pride in the top three economies, and this is Modi’s guarantee,” he said that day.
Criticising his remarks, the Congress party said India’s emergence as the world’s third-largest economy is “guaranteed” regardless of who forms the government after the 2024 elections. “Typical of Mr. Modi to give his personal guarantee on an arithmetical inevitability. India’s emergence as the world’s 3rd largest economy in this decade has been predicted for quite some time now, and its guaranteed – whichever dispensation forms the next government,” Congress leader Jairam Ramesh said the same day.
Without referring to any opposition party or leader, Sitharaman on Thursday said: “It is the people of India who moved it [the economy] from tenth to fifth, and from fifth to the third. To say that it can be a ‘fait accompli’ and therefore, there’s no effort… is to undermine the people of India. People elected Modi-led National Democratic Alliance (NDA) with overwhelming majority twice – in 2014 and 2019. The next general election is due in the first half of 2024”.
The finance minister said people elected the Modi government twice because they “aspire for better” and their efforts are really pushing up the economy. They include entrepreneurs, farmers, and the economically weaker sections of the society aspiring for better, she said.
“You are students of economics. Will know that most often when we are talking about [an] explanation, a narrative; we normally take onboard ‘ceteris paribus’ … We always say, if other things remain constant this is what will happen…,” she said in reference to the government’s assertion that India would become the third largest economy of the world in the next five-year period of 2024-29.
She said despite all odds and global headwinds – starting from the outbreak of Covid-19 pandemic to the Ukraine war and volatile global macroeconomic situation, including disruptions in supply of food, fuel and fertiliser -- the Indian government steered the economy well to achieve the fifth position.
While India has been able to navigate through all these problems, the global situation is still volatile because of geopolitical reasons, particularly the war, she said. “There was a time in 2022 when people thought [the war will] not [continue] beyond six months. But it’s going on,” she said pointing towards global supply-chain disruptions leading to hunger in many countries.
Any “flip-flop” in political will power would affect the economic performance and hinder the economic stability, she added.
She called SRCC as a premier “trend-setting” college of the country and said three of her personal staff were alumni of the institution. Two of them have moved to other promising areas – one in the administrative service and the other in politics, she added. Speaking about the third, she said: “I will wait to see where will he go now... all three of them contributed very well.”
She recalled former finance minister Arun Jaitley, SRCC alumnus, as a “phenomenal personality” and her “mentor”. He loved three things – food, Sri Ram College and Cricket, she said adding that he would talk “most often” about the three things than politics.
Get Latest India News and Uttarakhand Tunnel Collapse Live Updates along with Latest News and Top Headlines from India and around the world
Indian Economy"
15,Hinduatan Times,Brave new world of women entrepreneurs,https://www.hindustantimes.com/opinion/brave-new-world-of-women-entrepreneurs-101695756294917.html,"Sep 27, 2023 01:11 AM IST","Brave new world of women entrepreneurs
By
Lalita Panicker
Sep 27, 2023 01:11 AM IST
The gig economy presents a significant opportunity for women's entrepreneurship, and the government needs to support the private sector in its business models.
One of the pillars of India’s G20 women-led development agenda is the promotion of women’s entrepreneurship. According to several studies, if women were represented in the formal economy on par with men, the Indian economy would grow by an additional 60% by 2025, adding $2.9 trillion. At present, only about 14% of all enterprises in India are women-led businesses. The sixth economic census says that women entrepreneurs account for 13.76% (about 8.05 million) of the total entrepreneurs of 58.5 million in India. Undoubtedly, there has been a growth in the number of women entrepreneurs, but it has been patchy and slow and needs to be stepped up.
PREMIUM
The existing women-led enterprises employ 30% of India’s female workforce with the capability to create around 150 million jobs by 2030 (PIC FOR REPRESENTATION))
The existing women-led enterprises employ 30% of India’s female workforce with the capability to create around 150 million jobs by 2030. But there are many gaps that hold women back as identified by a research study by MicroSave Consultancy. One is the lack of space, capital, and support to get started. By and large, in India, we do not have physical incubation/acceleration spaces that recognise the unique challenges faced by women entrepreneurs. Among these are the need for shared services (legal, accounting), exhibition space, mentorship and peer to peer support. Women in tier 2 and tier 3 cities also need online/hybrid support that takes into account the time and mobility constraints of women entrepreneurs.
An enormous challenge that aspiring women entrepreneurs face is access to finance. Most financial products are not designed or delivered in a manner that is tailored to their needs. Issues around collateral and gendered approaches to loans lead to women having to borrow from the informal sector or remain in low capital/low growth enterprises. What we need are appropriate financing solutions which begin bottom up, tailored to the requirements of women entrepreneurs. The delivery and design of these cannot be based on the old models but through innovative approaches after consulting the women.
Yashodhara Bajoria, co-founder, CAXpert, an online accounting platform that provides low-cost accounting solutions and financial analytics to small business owners says, “Categorising entrepreneurs based solely on traditional factors like turnover and investments is limiting. To truly empower entrepreneurs, we need insights into their mindset and approach. Compliance psychology provides this crucial understanding. It not only aids resource allocation but also informed policy development. At CAXpert, we believe this is where meaningful change begins.”
Women entrepreneurs and aspiring ones have suffered for lack of a collective voice. There is no single collective focused on promoting women’s entrepreneurship. This has several fallouts, among them the lack of negotiating power, lack of agenda setting ability, lack of ability to shape the narrative on critical issues and a lack of visibility on tailwinds, trends and opportunities.
In the past, we have had models like SEWA and Lijjat papad, among a few others, that have shown what could work for mass women entrepreneurship. But beyond that, no new models which keep in mind changing technologies and access routes to finance have come up which can be scaled across geographies. There is also a significant gap in women’s entrepreneurship models designed for urban and rural areas.
The greatest potential today for women’s entrepreneurship lies in the gig economy, which is estimated to grow to 2.35 crore (23.5 million) workers by 2030. This has been boosted by the growing use of smartphones, internet penetration, education and digital payments infrastructure. The government has to do much more to support the private sector to identify, test and validate business models that are suitable for women entrepreneurs. The G20 summit has laid out the aspirations, now for the implementation.
The views expressed are personal
Continue reading with HT Premium Subscription
Daily E Paper I Premium Articles I Brunch E Magazine I Daily Infographics
Subscribe Now @1199/year
Already Subscribed? Sign In
ABOUT THE AUTHOR
Lalita Panicker
Lalita Panicker leads the opinion section at Hindustan Times. Over a 33-year career, she has specialised in gender issues, reproductive health, child rights, politics and social engineering.
Indian Economy"
16,Hinduatan Times,Food cost spoils inflation spread,https://www.hindustantimes.com/editorials/food-cost-spoils-inflation-spread-101694699465138.html,"Sep 14, 2023 10:09 PM IST","Food cost spoils inflation spread
ByHT Editorial
Sep 14, 2023 10:09 PM IST
Govt may want to keep grain prices under check. But hawkish monetary intervention from RBI could be counterproductive
India’s benchmark inflation measure, the Consumer Price Index (CPI), grew at 6.8% in August, lower than the 7.4% print in July but higher than the 6% upper limit of RBI’s tolerance band. Wholesale prices, as measured by the Wholesale Price Index (WPI), contracted by 0.5% in August, making it the fifth consecutive month of contraction. Lest there is confusion, it is important to reiterate that the widely divergent trends in CPI and WPI are not a reflection of prices in wholesale and retail markets. The two indices have very different compositions. WPI has a smaller weight for food, includes a lot of industrial inputs and does not have services. If one were to compare similar sub-components between these two indices, the trends are the same. Inflation continues to remain a problem for critical food items such as cereals and pulses, and it is benign for non-food, non-fuel items.
PREMIUM
the Consumer Price Index (CPI), grew at 6.8% in August (REUTERS)
What does this mean for the Indian economy in the next few months?
With the base effect dissipating, WPI should get out of the contraction zone from next month. A month-on-month comparison shows that prices are actually increasing on a sequential basis. This is not a bad development because it will give some boost to the nominal GDP growth numbers, which serve as the base for tax revenues. A benign core inflation environment both in the retail and wholesale inflation numbers shows that the economy is well placed to enjoy the positive effects of a revival in the private capex cycle. While there are some signs of this happening, it is still not a given and at best work in progress.
The only problem, as far as the inflation numbers are concerned, is on the food grain (cereals, pulses) front given the prospects of a bad summer and winter harvest due to a weak monsoon at a time when inflation is already very high for these items. Pragmatically speaking, this is a terms-of-trade challenge for the fiscal arm of the government, which will have to do everything it can to control prices without increasing farmer anger in an election year. But India’s inflation targeting framework will force RBI to respond to it. A hawkish monetary intervention could end up being counterproductive given the nascent stage of private capex revival.
Continue reading with HT Premium Subscription
Daily E Paper I Premium Articles I Brunch E Magazine I Daily Infographics
Subscribe Now @1199/year
Already Subscribed? Sign In
Inflation
Rbi
Consumer Price Index
Indian Economy"
18,Hinduatan Times,Q1 growth at 7.8% as Indian economy braves headwinds,https://www.hindustantimes.com/india-news/indian-economy-grows-7-8-in-q1-despite-external-headwinds-driven-by-strong-domestic-demand-and-services-sector-101693506710322.html,"Sep 01, 2023 12:01 AM IST","Q1 growth at 7.8% as Indian economy braves headwinds
By
Roshan Kishore
, Rajeev Jayaswal, New Delhi
Sep 01, 2023 12:01 AM IST
To be sure, almost all projections, including RBI’s, expect the annual growth number for 2023-24 to be lower than the June quarter numbers
Strong domestic demand driven by government capex and a continuing recovery in contact intensive services helped the Indian economy build on its growth momentum despite external headwinds in the first quarter of the current fiscal year.
HT Image
India’s GDP growth in the quarter ending June was 7.8%, the National Statistical Office (NSO) said in a release on August 31. The latest numbers are exactly in line with a projection by Bloomberg poll of economists and 1.7 percentage points more than the 6.1% number in the previous quarter. To be sure, the latest growth numbers are marginally below the 8% projection by the Monetary Policy Committee (MPC) of the RBI.
We're now on WhatsApp. Click to join.
Indian economy’s “growth prospects appear bright” despite downward risks from external factors such as “firming of prices of crude oil” and “prolonged geopolitical uncertainty”, chief economic adviser (CEA) V Anantha Nageswaran said while commenting on the GDP numbers. Analysts concurred with CEA’s assessment, identifying a service sector driven boost to domestic economy activity as an effective antidote to the headwinds from external markets.
To be sure, almost all projections, including RBI’s, expect the annual growth number for 2023-24 to be lower than the June quarter numbers. This is more a reflection of the fact that the June quarter numbers enjoy a favourable base effect. RBI’s MPC resolution released in August projected a growth rate of 6.5% for 2023-24 with quarterly growth numbers being 8%, 6.5%, 6% and 5.7% in the quarters ending June 2023, September 2023, December 2023 and March 2024 respectively.
An expenditure-side analysis of the GDP numbers shows that private consumption and investment (as captured by Gross Fixed Capital Formation) numbers have played an important role in driving the growth momentum. While Private Final Consumption Expenditure increased by 6% on an annual basis, investment spending increased by 8%. This provided a crucial buffer to the headline GDP number despite a three-fold decline in net exports of goods and services driven by a fall in exports and rise in imports.
A look at the sector-wise Gross Value Added (GVA) numbers shows that services played an important role in building the growth momentum during this period. Services as a whole have grown by 10.3% on a year-on-year basis contributing almost three-fourth to the overall growth in GVA.
A slowdown in the global economy and trade may moderate export growth, but services sector would remain a key driver, CEA said identifying the sector as a key driver of economic momentum.
“Headline growth was driven higher by continued momentum in the tertiary sector, even as the primary and secondary sectors were generally weaker compared to the previous quarter,” Rahul Bajoria, head of EM Asia (ex-China) Economics Research, Barclays, said in a note. “For FY 23-24, we maintain our forecast of 6.3%, but see modest upside risks to our forecast. Domestic demand is likely to anchor GDP growth, but some moderation may come from weaker manufacturing and exports in a global slowdown,” the note added.
Another important aspect of the latest GDP numbers is the near congruence in real and nominal growth numbers with the latter being just 20 basis points – one basis point is one hundredth of a percentage point – more than the latter. This is likely a result of fall in commodity prices – the wholesale price index contracted by 2.6% in the June quarter – which has given both a real and statistical boost to constant price numbers. In fact, in some sub-sectors including manufacturing, nominal growth numbers are lower than the real growth number. While declining commodity prices have played a role in bringing down core inflation, a moderation in nominal growth can have an adverse impact on revenue collections for the government.
To be sure, the economic policy landscape at the current juncture might be very different from what the June numbers suggest because of the performance of the monsoon season.
With August 2023 being the driest since 1901, even a normal rainfall in September – which is what the IMD has projected on August 31 – could leave to a significant rainfall deficit in the monsoon season this year notwithstanding the fact that it might not meet the technical threshold for being a deficient monsoon year. This is likely to give a further boost to inflation for key food items such as cereals which are already at uncomfortable levels. Cereal inflation came in at 13% in July 2023, making it the 12th consecutive month of double-digit inflation in the subcategory.
While the impact of deficient rains in August needs to be watched, food inflation is likely to subside with the arrival of fresh stock in the market and the government’s pre-emptive measures, CEA said. Although inflation rose in June and July 2023, India’s dynamics are still better compared to other economies as core inflation is declining and the food inflation is transitory, he added.
“While the government has taken multiple steps to control food and overall inflation, including the reduction in prices of LPG cylinders earlier this week, experts believe that these might effect collateral damage in terms of worsening of terms of trade for farmers. With production already likely to take a hit due to deficient rainfall in large parts and floods in key states such as Punjab, aggressive price control measures will entail a double whammy for farmers, which is bound to hurt rural demand,” said Himanshu, an associate professor of economics at Jawaharlal Nehru University.
“The fall in commodity prices has led to buoyant economic activity over the last few quarters. This has been visible in higher corporate margins and improved purchasing power. Going forward, the intensification of the El Nino weather phenomenon is the biggest risk to the rural economy and overall GDP growth. Already, we find that rural indicators such as real rural wages and non-durables consumption, are weakening. As the base normalises, and rural demand comes under pressure led by the El Nino, we expect GDP growth prints to slow from here on, averaging 5.8% in FY24,” said Pranjul Bhandari, Chief India and Indonesia Economist.
Given the precarious situation around food prices, the government’s political fortunes – there is less than a year to go for the 2024 general elections and the penultimate state election cycle is scheduled for end of this year – are more likely to depend on its management of this inflation-rural income contradiction rather than headline growth numbers.
Get Latest India News and Uttarakhand Tunnel Collapse Live Updates along with Latest News and Top Headlines from India and around the world
ABOUT THE AUTHOR
Roshan Kishore
Roshan Kishore is the Data and Political Economy Editor at Hindustan Times. His weekly column for HT Premium Terms of Trade appears every Friday.
Indian Economy
Gdp Growth"
19,Hinduatan Times,What the GDP numbers show,https://www.hindustantimes.com/editorials/what-the-gdp-numbers-show-101693488631760.html,"Aug 31, 2023 10:31 PM IST","What the GDP numbers show
ByHT Editorial
Aug 31, 2023 10:31 PM IST
The economy is doing well despite headwinds. But keep a watch on rainfall and food prices
India’s GDP grew at 7.8% in the quarter ending June 2023, exactly what a Bloomberg poll of economists predicted and broadly in line with the 8% forecast by the Monetary Policy Committee (MPC) of the Reserve Bank of India (RBI) in its August resolution. Given the fact that there are no surprises in the headline number, what do the latest GDP statistics tell us about the economy? Here are three key takeaways.
PREMIUM
What do the latest GDP statistics tell us about the economy? Here are three key takeaways.(Representative image)
The first message is that the Indian economy continues to do well despite headwinds on the external front. 7.8% growth, whichever way one looks at it, is a good number, and it looks even more impressive in the wake of the fact that exports have fallen compared to the same period last year and imports have increased. While the international economic environment continues to remain volatile, strength in domestic economic activity is clearly good news.
The second key message requires reading the real and nominal numbers together. In some important sectors such as manufacturing, trade and other services, the real growth number is higher than the nominal growth number on a year-on-year basis. This confirms the point made by some analysts that the latest numbers have some element of statistical boost due to methodological issues around the use of a deflator (to remove the effect of inflation from the numbers). To be sure, they do not take away from the fact that the economy continues to do well.
The third and most important takeaway is that even at this point in time in September, the political economy situation may have changed significantly compared to what the June quarter numbers show. Rainfall performance up to August and IMD’s projections for September indicate a high likelihood of monsoon being deficient in large parts of the country. This, given the already high levels of inflation in key food items such as cereals and pulses, might generate tailwinds for food inflation. The government’s aggressive intervention in food markets confirms that it is not oblivious to this threat. While its policies might help control food inflation, they are likely to worsen terms of trade for farmers, in turn generating headwinds for rural demand. This would not matter so much in a normal year, given agriculture’s low weight in national income, but it has the potential of generating political discontent in a pre-election year. The government’s central economic challenge, going forward, will be maintaining this fine balance between inflation and farm incomes.
Continue reading with HT Premium Subscription
Daily E Paper I Premium Articles I Brunch E Magazine I Daily Infographics
Subscribe Now @1199/year
Already Subscribed? Sign In
Reserve Bank Of India
India's Gdp
Inflation
Services
Indian Economy
September
Monsoon
Trade
Farmers
Terms Of Trade"
