id,publisher,title,link,publish_details,content
20,Hinduatan Times,Free domestic capital from onerous fetters,https://www.hindustantimes.com/opinion/free-domestic-capital-from-onerous-fetters-101693188537776.html,"Aug 28, 2023 08:19 AM IST","Free domestic capital from onerous fetters
ByJanmejaya Sinha
Aug 28, 2023 08:19 AM IST
Our regulations are increasingly restrictive and create a compliance load. We should not be crimping our nation’s entrepreneurship
My most fervent wish about India is that all Indians have the chance of a life worth living. It is not in doubt that India will become the world’s third largest economy before the decade is over. But to join the ranks of developed nations by our 100th year of Independence, we will need to increase the productivity of our human capital and better use our domestic capital. I have often talked about the need to invest handsomely in our soft infrastructure; however, the focus of this piece is on giving some freedom to our entrepreneurs in the use of domestic capital.
PREMIUM
All countries grow on the back of domestic capital augmented by foreign capital, not the other way round
There is a lot of talk around domestic capital formation and disappointment that the savings rate has come down below 30%. There is also discussion around improving the liquidity and depth in our bond markets. However, there is not much discussion on how the capex cycle really runs in India and what is needed to give it a boost. Arguing a sui generis case for India in the face of established theory is always a lonely path, but one that I will embark on in this piece.
The Indian economy is very different in its structure from the economies of the United States (US) and United Kingdom (UK) on multiple dimensions - in the stage of development, in the depth and liquidity of equity markets, and in the importance of family owned and managed businesses. India is a bank-led economy. Savings are intermediated through banks. Equity participation is very low. If we go to rural areas, the highest form of savings is in land, followed by gold. Financial savings are deposits mostly in nationalised banks. Countries such as Japan and even Europe are more akin to us, than the US and UK. This said, the US and UK have had the largest impact on our financial regulations.
At Independence, there were many in the UK that expected us to implode. In fact, the need for bank nationalisation in 1969 was part recognition that no foreign commercial capital was available to India. We needed to find our own resources within India. Bank nationalisation helped give confidence to depositors. Rapid rural branch opening helped garner their deposits. Bank branches more than doubled from 8,000 to 18,730 – as rural and semi- urban branches increased to 12,405. By 1990, India had almost 60,000 branches, of which 46,115 were in rural and semi-urban areas, raising ₹3,14,823 crore in bank deposits.
The deposits raised were invested in national priorities by mandating the banks to buy approved government securities to meet the statutory liquidity ratio (SLR) which was set at 35%. Cash reserve ratio, the deposits banks held with Reserve Bank of India (RBI), was set at 15%. Thus, 50% of bank deposits raised were impounded. The residual assets were also directed. Defined priority sectors got 40% of advances and corporate credit was largely allocated through the credit authorisation scheme run by RBI. Project finance was provided by development finance institutions that had access to concessional liabilities from RBI. Retail credit was barely available. Clearly, the structure of a capital-starved economy.
Entrepreneurship was either through the State or through family-owned and managed businesses. This largely remains the structure today (except for recent startups) with more than 300 of the top 500 Indian companies being family-owned. Most micro, small and medium enterprises (MSMEs) are also family-owned. It is true that prior to the reforms in 1992, the promoter had enormous fungibility in the use of a company’s capital. This led, at times, to a misappropriation of capital for private gain, by some less scrupulous business groups (without even a majority stake). However, history also shows us that because of this flexibility in the use of company funds, a Tata Steel could start Tata Motors, or a Tata Industries could start Titan. The same was true of other industrial conglomerates.
The International Monetary Fund-influenced reforms of 1992 insisted on much greater tightening of these rules in line with US best practice and at the behest of foreign financial institutions. The use of company capital became much more restrictive than before. This trend continues to accelerate, inspired by economies that are equity led and at a different stage of development. As a result, we are now very protective of the interests of minority shareholders. Foreign investors, especially from the West, inhibit capital investments in other businesses by asset-rich and liquidity poor promoters. The investors from the Middle East and Far East understand conglomerates better. In the early 20th century, the prevailing orthodoxy in the US was also different from what our entrepreneurs experience today.
Our regulations are increasingly restrictive and prescriptive, and create an enormous compliance load. We must question whether rules are needed on market rumours in social media, and why the public needs to know family arrangements. By and large, Indian companies have been the engines of India’s growth, they have provided jobs and been considerate employers. If some misuse funds for private gains, we should prosecute them. But our regulatory structure should not be created for thieves, it should be created for wealth-creating industrialists. We should not be crimping our own entrepreneurship, not at this time.
We need to recognise that all countries grow on the back of domestic capital augmented by foreign capital, not the other way round. The finance minister was on point in her budget this year, asking for a comprehensive review of our financial regulations with public and regulated entity participation. The announcement could not have come a day too soon.
Janmejaya Sinha is India chairman, Boston Consulting Group. The views expressed are personal
Continue reading with HT Premium Subscription
Daily E Paper I Premium Articles I Brunch E Magazine I Daily Infographics
Subscribe Now @1199/year
Already Subscribed? Sign In
India
Liquidity
Indian Economy"
22,Hinduatan Times,Four charts which explain the politics and economics of inflation,https://www.hindustantimes.com/india-news/four-charts-which-explain-the-politics-and-economics-of-inflation-101692727728048.html,"Aug 22, 2023 11:44 PM IST","Four charts which explain the politics and economics of inflation
By
Roshan Kishore
Aug 22, 2023 11:44 PM IST
Understanding the problem of price rise in the country
How bad is the inflation problem in the Indian economy? First, RBI’s Monetary Policy Committee (MPC) issued some hawkish rhetoric on the inflation problem. This was followed by a higher than expected 7.44% inflation print in the month of July. We are now witnessing aggressive government intervention in food markets. An HT analysis shows that while the Indian economy is far from overheating, food price pressures are likely to keep the government on its toes as the 2024 elections come closer. Here are four charts which explain this in detail.
PREMIUM
Food prices are behind the recent price rise.
Get Latest India News and Uttarakhand Tunnel Collapse Live Updates along with Latest News and Top Headlines from India and around the world
ABOUT THE AUTHOR
Roshan Kishore
Roshan Kishore is the Data and Political Economy Editor at Hindustan Times. His weekly column for HT Premium Terms of Trade appears every Friday.
Indian Economy
Number Theory"
23,Hinduatan Times,Can industrialisation and inclusivity coexist?,https://www.hindustantimes.com/opinion/can-industrialisation-and-inclusivity-coexist-101691244280629.html,"Aug 05, 2023 11:07 PM IST","Can industrialisation and inclusivity coexist?
By
Mark Tully
Aug 05, 2023 11:07 PM IST
The government launches campaigns for inclusive development, but amendments to Forest Conservation Act may harm the poorest citizens.
Economists are arguing fiercely about the direction of the Indian economy. Does the prime minister (PM) believe industrialisation is the way ahead or is he trying to develop an inclusive economy? When he coined the phrase Sabka Saath Sabka Vikas (development with all, for all) he seemed firmly set on the inclusive way forward. Then, there were also schemes to benefit individuals such as building lavatories, distribution of domestic gas cylinders, and the encouragement to open bank accounts. There was also the Swachh Bharat or Clean India campaign. However, the tribal region of Madhya Pradesh, which I know well, doesn’t seem much cleaner. Many of the built lavatories are being used for storage. It seems as if these schemes may not have been as successful as suggested by the Press Information Bureau (PIB) and reiterated by some television networks that have become accustomed to toeing the government’s line.
PREMIUM
In India, the poorest of the poor live in the forests and are dependent on them for their livelihood. (HT file)
The PM seems to have furthered his image of a man who believes that inclusive economics needed another boost. On April 21, PIB announced that the PM would be launching nine campaigns under the theme of Samaveshi Vikas or inclusive development. Among the areas to be covered are employment, health, social inclusion, social security and livelihood creation.
Of course, there is a website and a mobile app. There is clearly politics involved in these inclusive programmes as they were launched from Madhya Pradesh, which is headed for an assembly election this year. But this week, the two Houses of Parliament passed an amendment to the Forest Conservation Act, 1980 which shows that PM Narendra Modi still wants to go ahead with privatisation for accelerating the growth rate of India, but for which the poor might pay a price. This is the liberal economy seen in the case of former British PM, Margaret Thatcher, which swept aside so many of the benefits of the poor won by previous socialist governments.
In India, the poorest of the poor live in the forests and are dependent on them for their livelihood. They are the ones who will be the hardest hit by the amendments to the Forest Conservation Act. In the now famous case of the Niyamgiri forests, the tribals forced the mining giant Vedanta to abandon its plans to mine bauxite in the hills. Noted environmentalist Sharachchandra Lele recently argued that these hills are not notified forests, and according to the amendment, mining can now start again.
The state of Odisha faces this problem in other forests as well, as do the northeastern states. The northeastern states are also threatened by the Centre’s ability to construct linear projects within 100 km of any international border. A linear project could mean a connection between two places, not just roads and railways but also possibly drainage systems, airports, pylons and plenty of other things. The Centre stated that the linear projects will be of “national importance and concerning national security”. And who decides this? The central government. The amendments, as a whole, undermine Indian federalism. The Northeast shares international borders with China, Bangladesh, and Myanmar, and it has problems with all of them. The amendments to the forest law could create further challenges for the security forces of the region.
Of course, there is a threat to its forests as well. And the amendments also open the gates to developers looking to profit from the Northeast’s natural wealth. Some experts have argued that the commercialisation of the Northeast and the forests of central India is one of the main aims of the amendments. Is this the price we have to pay for development?
The views expressed are personal.
Continue reading with HT Premium Subscription
Daily E Paper I Premium Articles I Brunch E Magazine I Daily Infographics
Subscribe Now @1199/year
Already Subscribed? Sign In
Prime Minister
Indian Economy"
24,Hinduatan Times,Cleaning up of NPA mess will propel the economy,https://www.hindustantimes.com/opinion/cleaning-up-of-npa-mess-will-propel-the-economy-101690207092857.html,"Jul 24, 2023 09:33 PM IST","Cleaning up of NPA mess will propel the economy
By
Shehzad Poonawalla
,
Sandeep Mishra
Jul 24, 2023 09:33 PM IST
The banking sector has made significant progress in addressing the NPA crisis representing a shift towards a more transparent and responsible financial future.
To understand the complexities of India’s banking sector, one needs to grapple with a term that tends to recur with unsettling regularity – non-performing assets (NPA). In the realm of banking, NPAs serve as ominous indicators of systematically flawed lending practices. The NPA crisis once cast long and haunting shadows on the integrity of our financial institutions. It posed a troubling question: How could so many loans, particularly to large corporations, turn bad? The answer, distressingly, was a tangled web of non-transparency, political interference, and systemic corruption that was allowed to thrive unchecked under the United Progressive Alliance (UPA) government. This culture of irresponsible lending led to a surge in willful defaulters. These unfortunate missteps were not mere policy oversights. They represented a fundamental disregard for the principles of accountability, transparency, and fiscal prudence, which are critical to the robust functioning of any banking system.
PREMIUM
The NPA situation in India before 2014 was severe. (Getty Images/iStockphoto)
The NPA situation in India before 2014 was severe. The gross NPA ratio of scheduled commercial banks (SCBs) stood at 4.9%, and ₹66.6 lakh crore in March 2014 were bad loans. The National Democratic Alliance (NDA) government took several steps to address the NPA problem, including setting up a new bad bank, the National Asset Reconstruction Company (NARC), to take over the management of stressed assets; introducing the Insolvency and Bankruptcy Code (IBC) 2016, which provided a framework for the resolution of stressed assets; and increasing the provisioning requirements for banks. Systematic and continuous efforts in the last nine years have effected a turnaround of the banking sector with robust growth. As per the Reserve Bank of India (RBI), scheduled commercial banks’ NPA ratio fell to a 10-year low of 3.9% in March 2023.
Public Sector Banks (PSBs) have also come a long way as their profits touched ₹1,04,649 crore in 2022-23. 12 PSBs witnessed a 57% increase in total profit compared to ₹66,539.98 crore earned in 2021-22. India’s largest lender, the State Bank of India, reported net NPAs of nearly ₹66,000 crore in 2018, but this came down drastically to ₹21,000 crore in FY23. The net NPA ratio also decreased. For FY23, SBI’s net profit crossed ₹50,000 crore, witnessing a growth of 58.6% year on year basis. Top private banks also have an NPA of less than 1%, and have posted huge profits. Private bank profits in FY23 were led by HDFC Bank at ₹36,961 crore, ICICI Bank at ₹23,339 crore, and Axis Bank at ₹13,025 crore.
PSBs are now utilising third-party data for in-depth due diligence at the loan sanctioning stage, mitigating risks from misrepresentation and fraud. The introduction of special mention accounts helps in the early detection of potential stress indicators in debt servicing, allowing banks to take preventative action against possible NPAs.
Comprehensive, automated early warning systems with around 80 triggers are being used by banks for timely remedial actions, enabling proactive stress detection and NPA reduction. Borrowers’ repayment behaviour is reported to credit information companies, which banks then use to inform their loan-sanctioning decisions, promoting better loan repayment habits.
As per the Economic Survey 2022-2023, the efforts of RBI and the government in terms of calibrated policy measures such as strengthening the regulatory and supervisory framework, implementation of the 4R approach of Recognition, Resolution, Recapitalisation and Reforms have culminated in the enhancement of risk absorption capacity and a healthier banking system balance sheet, both in terms of asset quantity and quality over the years. Today, we can confidently say that India’s banking sector, once embroiled in an NPA crisis, is well-positioned for sustainable growth, with a robust infrastructure that is more transparent, accountable, and resilient. The turnaround story scripted by the government signifies more than a successful policy implementation; it represents a shift in the economic ethos towards a more prudent and responsible financial future.
This transformation, underpinned by the principle of good governance, has set the stage for India to emerge as one of the top three economies in the coming years.
Shehzad Poonawalla is national spokesperson of the BJP, and Sandeep Mishra is member, UN Mastermind Groups 2022. The views expressed are personal.
Continue reading with HT Premium Subscription
Daily E Paper I Premium Articles I Brunch E Magazine I Daily Infographics
Subscribe Now @1199/year
Already Subscribed? Sign In
Banking System
India
Banking
Asset
World Economy
Indian Economy"
26,Hinduatan Times,Wholesale prices contract for third consecutive month,https://www.hindustantimes.com/business/wholesale-prices-contract-for-third-consecutive-month-in-june-reflecting-cost-deflation-in-indian-economy-101689419573304.html,"Jul 15, 2023 04:42 PM IST","Wholesale prices contract for third consecutive month
By
Pavitra Kanagaraj
Jul 15, 2023 04:42 PM IST
The Wholesale Price Index (WPI) contracted by 4.12% in June reaching its lowest value since October 2015
NEW DELHI: Wholesale prices contracted for the third consecutive month in June on the back of lower prices of manufactured items, reiterating the fact that falling commodity prices are contributing to a cost deflation in the Indian economy.
Vegetable prices contracted by 21.98% while pulses and milk witnessed inflation rates of 9.21% and 8.59%. (PTI File)
The Wholesale Price Index (WPI) contracted by 4.12% in June reaching its lowest value since October 2015 according to the data released by the ministry of commerce and industry on July 14 (Friday).
We're now on WhatsApp. Click to join.
Even in absolute terms, the WPI index was 149 in June, the lowest since March 2022. The WPI data has come days after Consumer Price Index (CPI) accelerated by 0.5 percentage points to reach 4.8% in June on the back of higher food prices. The June CPI and WPI values are the latest the Reserve Bank of India’s Monetary Policy Committee (MPC) will look at when it meets in August to decide on interest rates. Most economists expect RBI to continue with the pause in interest rate hikes for an extended period, without dropping its guard on inflation.
The June WPI sprang a big positive surprise. A Bloomberg poll of economists had a median projection of 3.3% contraction in WPI for the month of June. With the latest inflation number, the wholesale price inflation for the quarter ending June 2023 is (-)2.8%. To be sure, one reason for the lower WPI print in the June quarter is a favourable base effect as the index grew in double digits for 18 consecutive months from April 2021.
A disaggregated analysis of WPI shows that prices are contracting across all major categories. Manufactured products, which have a two-thirds share in the WPI basket, saw a contraction of 2.7% in June. Primary articles saw a contraction of 4.1% and fuel and power category saw a contraction of 12.6%. Food items, which include both primary and manufactured products, saw an annual contraction of 1.2% in wholesale prices. Vegetable prices contracted by 21.98%, while pulses and milk witnessed inflation rates of 9.21% and 8.59%.
“The decline in the rate of inflation in June, 2023 is primarily due to fall in prices of mineral oils, food products, basic metals, crude petroleum & natural gas and textiles,” the commerce ministry said in a statement.
Going forward, experts believe that WPI will continue to maintain a deflationary trend despite some upside risks. “Reversal in base effects from July and seasonal rise in food prices may put some upside pressure on WPI in the near term, but falling commodity prices and therefore, input costs, may continue to keep it in deflation in y-o-y (year-on-year) terms,” said Rahul Bajoria, managing director and head of EM Asia (ex-China) economics, Barclays, in a note.
ABOUT THE AUTHOR
Pavitra Kanagaraj
Pavitra Kanagaraj is a data journalist. She uses public and private datasets to cover economy, women, and politics. Prior to HT, she did macroeconomic research at UNESCAP and ERF. She co-founded the Rethinking Economics chapter at JNU in 2021.
Indian Economy"
27,Hinduatan Times,Indian banks now more profitable: FM Nirmala Sitharaman,https://www.hindustantimes.com/india-news/indian-economy-has-moved-away-from-twin-balance-sheet-problem-banks-now-profitable-fm-101688200089718.html,"Jul 01, 2023 02:12 PM IST","Indian economy has moved away from twin-balance sheet problem, banks now profitable: FM Nirmala Sitharaman
PTI |
Jul 01, 2023 02:12 PM IST
Profit of public sector banks increased to ₹1.04 lakh crore in 2022-23, tripling from what it was in 2014, Nirmala Sitharaman said.
Finance Minister Nirmala Sitharaman said on Saturday that the Indian economy has moved away from the twin-balance sheet problem of banks and corporates to twin-balance sheet advantage because of the concerted efforts of the Modi government.
Union Finance Minister Nirmala Sitharaman virtually inaugurates a branch of the Punjab and Sind Bank in Assam's Karimganj, in New Delhi, Saturday, July 1, 2023. (PTI)
Profit of public sector banks increased to ₹1.04 lakh crore in 2022-23, tripling from what it was in 2014, the minister said while inaugurating the corporate office of Punjab & Sind Bank here.
We're now on WhatsApp. Click to join.
The twin-balance sheet problem refers to deterioration in financial health of banks and corporates at the same time.
""As a result (of various initiatives of the government) I'm glad to say the problems of twin-balance sheets have gone away like the Reserve Bank observing it is a twin-balance sheet advantage that the Indian economy is benefiting from,"", Sitharaman said.
The minister said the term twin-balance sheet was heard after a long time and according to the Reserve Bank, the Indian economy is now benefiting from the twin-balance sheet advantage.
She said performance of public sector banks have improved on account of various initiatives taken by the Modi government since 2014. There was an improvement in all critical parameters like return on asset, net interest margin and provisioning coverage ratio, she added.
Get Latest India News and Uttarakhand Tunnel Collapse Live Updates along with Latest News and Top Headlines from India and around the world
Nirmala Sitharaman
Profit
Finance Minister
Indian Economy
Modi Government"
